mysql

Mysql
https://losst.ru/ustanovka-mysql-centos-7
https://losst.ru/sozdanie-polzovatelya-mysql
https://ru.piliapp.com/mysql-syntax-check/
проверка синтаксиса
https://yournet.kz/blog/mysql/ispravlenie-oshibok-v-baze-mysql
исправление ошибок в базе данных!!!!

Узнать пароль автоматический при установке который был
grep 'temporary password' /var/log/mysqld.log  # временный пароль посмотреть 
Nq+hONHa<0GQ
Nq+hONHa<0GQ1 #новый 
#############################################################
Вопрос how to change TYPE in mysql?:
Итого самое важное:

1 DESCRIBE users;   # смотрю описание конкретной таблицы users (не базы данных)
2 drop database test;  # удалил конкретную таблицу
3 \s   # status инфа о базе данных (смотрим под кем зашли, какая база данных выбрана, пользователя)
4 \q выйти 
5 SELECT COUNT(*) FROM users;  # посчитал количество записей в таблице users
6 GRANT SELECT,INSERT,DELETE,UPDATE ON company.* TO 'admin'@'localhost' IDENTIFIED BY 'Nq+hONHa<0GQ1';  # создаю пользователя с конкретными правами
7 mysql -u root -p    # авторизация от рута ; точка с запятой не надо
mysql -p # от рута подключаюсь  тоже так можно 
HELP # подсказки по командам без точки с запятой;
STATUS # аналог \s под кем зашел статус базы данных подключения к базе 
8 mysql -u admin -p   # авторизация пользователя
9 SHOW GRANTS FOR 'admin'@'localhost';  # смотрю права конкретного пользователя 
10 ls -lah /var/lib/mysql # здесь можно посмотреть все базы данных на сервере company, и другие 
ls -lah /var/lib/mysql/company/  ## тут вся инфа о бозе данных company

11.1 FLUSH PRIVILEGES; # обновить права в mysql
11 REVOKE ALL PRIVILEGES ON test_database . * FROM 'test_user'@'localhost'; # забираю права

12 SHOW PROCESSLIST;		 # смотрю какие сейчас процессы происходят 

13 find / -name my*.cnf # ищу конфиг mysql
/etc/my.cnf   # для простого сайта править ничего не надо только для высоконагруженных систем
Оптимизация mysql это очень тонкое дело зависит от ситуации

cd /usr/share/doc/ # раньше тут были шаблоны конфигов mysql

14 mysqldump --opt -p company  > company.sql   # пароль 
mysqldump -u root -p company > company.sql

less company.sql # почитать базу посмотрим что внутри 

DROP TABLE IF EXISTS `users`;
/*!40101 SET @saved_cs_client     = @@character_set_client */;
/*!40101 SET character_set_client = utf8 */;
CREATE TABLE `users` (
  `id` int(5) NOT NULL AUTO_INCREMENT,
  `name` varchar(64) DEFAULT NULL,
  `surname` varchar(64) DEFAULT NULL,
# тут говорится если будет сделан импорт то будет удалена текущая таблица и заменена на новую 

LOCK TABLES `users` WRITE;
/*!40000 ALTER TABLE `users` DISABLE KEYS */;
INSERT INTO `users` VALUES (1,'Ivan','Petrov',25,'petrov@company.ru','work'),(2,'Sergey','Malevin',29,'serg@company.ru','work'),(3,'Fyodor','Karpin',27,'fyodor@company.ru','work');
# во время импорта сделать следующие insert 

15 DROP DATABASE company;  # удалил базу конкретную 
##################################################################################################
17 Импорт базы данных на сервере 
1 mysql -p 
2 DROP DATABASE company;
show databases;   # вижу что уже нету 
3 \q

4 mysql -p
CREATE DATABASE company; ## помни если базу удалил ее надо создать а потом импортировать
SHOW DATABASES;  		 # увижу company базу данных 

5 mysql -u root -p company < company.sql  # делаю импорт базы данных 

6 mysql -p # смотрим что туда закачалось 
7 USE company; 			# перехожу на нужную базу данных
  SHOW TABLES;         #смотрю таблицы 
  SELECT * FROM users;  # смотрию данные таблицы users 

  +----+--------+---------+------+-------------------+--------+
| id | name   | surname | age  | email             | status |
+----+--------+---------+------+-------------------+--------+
|  1 | Ivan   | Petrov  |   25 | petrov@company.ru | work   |
|  2 | Sergey | Malevin |   29 | serg@company.ru   | work   |
|  3 | Fyodor | Karpin  |   27 | fyodor@company.ru | work   |
+----+--------+---------+------+-------------------+--------+
###############################################################################
18 если база данных испортилась 
https://yournet.kz/blog/mysql/ispravlenie-oshibok-v-baze-mysql

myisamchk /var/lib/mysql/company/users.MYI # проверка базы данных на ошибки можно так посмотреть 

29 myisamchk -r /var/lib/mysql/company/users.MYI # рекомендуется использовать для восстановления таблицы
   myisamchk -o /var/lib/mysql/company/users.MYI  # если -r не помог то тогда -o

18.1 
mysqlcheck -u root -p --optimize --auto-repair --all-databases 
--optimize – Оптимизируем все базы.
--auto-repair – Ремонтируем все базы.
--all-databases – Проверяем ошибки у всех баз.

18.2 mysqlcheck -r имя_базы имя_таблицы_в_базе -u root -p  # проверка отдельной таблицы в базе данных
#################################################################

настройка mysql
sudo yum install wget

yum -y install mysql-server

1 systemctl start mysqld
2 systemctl status mysqld


Узнать пароль автоматический при установке который был
grep 'temporary password' /var/log/mysqld.log  # временный пароль посмотреть 
Nq+hONHa<0GQ
Nq+hONHa<0GQ1 #новый 


3 mysql -u root -p  # авторизация

\s   # status инфа о базе данных (смотрим под кем зашли, какая база данных выбрана, пользователя)

Connection id:		15 # уникальный номер
Current database:	 # текущая база данных
Current user:		root@localhost # пользователь под кем зашли в базу данных
Server characterset:	latin1  # кодировки
Db     characterset:	latin1 
UNIX socket:		/var/lib/mysql/mysql.sock # каким образом подключение происходит
Queries per second avg: 0.001    # секунду в запрос


\q   # выйти

3 show databases; 					#; нужна так, как длинная команда может быть в mysql 
drop database test;        # название  test базы которой удаляем
information_schema       # удалять нельзя 

#######################################################
company

4 CREATE DATABASE company;  # создал базу данных company

5  USE company;    # сделал базу company текущей 
\s

Current database:	company          # текущая база данных
Current user:		root@localhost   # под каким пользователем

6  show tables;        # показать смотри какие есть таблицы в этой базе данных
Empty set (0.00 sec)

7 CREATE TABLE users ( id INT(5) AUTO_INCREMENT PRIMARY KEY, name VARCHAR(64), surname VARCHAR(64), age TINYINT(3), email VARCHAR(64), status VARCHAR(128)) DEFAULT CHARACTER SET UTF8;

# создать таблица users, AUTO_INCREMENT PRIMARY KEY автопывашение на 1, имя размер 64 символа, фамилия 64 символа, возраст 3 символа,  email, status, кодировка по умолчанию DEFAULT CHARACTER SET UTF8 !!!

8 show tables;
появится users таблица своего рода шаблона

9 DESCRIBE users;   # смотрю описание конкретной таблицы users (не базы данных)
+---------+--------------+------+-----+---------+----------------+
| Field   | Type         | Null | Key | Default | Extra          |
+---------+--------------+------+-----+---------+----------------+
| id      | int(5)       | NO   | PRI | NULL    | auto_increment | # только id будет автоматом повышаться на единицу
| name    | varchar(64)  | YES  |     | NULL    |                |
| surname | varchar(64)  | YES  |     | NULL    |                |
| age     | tinyint(3)   | YES  |     | NULL    |                |
| email   | varchar(64)  | YES  |     | NULL    |                |
| status  | varchar(128) | YES  |     | NULL    |                |
+---------+--------------+------+-----+---------+----------------+
6 rows in set (0.01 sec)

10 INSERT INTO users VALUES(' ', 'Ivan', 'Petrov', '25', 'petrov@company.ru', 'work'); # вставляю значения по полям в таблице выше id, имя, фамилия, возраст, почта, статус

1 INSERT INTO users VALUES('1', 'Ivan', 'Petrov', '25', 'petrov@company.ru', 'work');  # id 1 сделал

2 INSERT INTO users VALUES('2', 'Sergey', 'Malevin', '29', 'serg@company.ru', 'tourism');

3 INSERT INTO users VALUES('3', 'Fyodor', 'Karpin', '27', 'fyodor@company.ru', 'work');


11  SELECT * FROM users;              # вижу что заполнял выше
+----+--------+---------+------+-------------------+---------+
| id | name   | surname | age  | email             | status  |
+----+--------+---------+------+-------------------+---------+
|  1 | Ivan   | Petrov  |   25 | petrov@company.ru | work    |
|  2 | Sergey | Malevin |   29 | serg@company.ru   | tourism |
|  3 | Fyodor | Karpin  |   27 | fyodor@company.ru | work    |
+----+--------+---------+------+-------------------+---------+


12 SELECT * FROM users;  # может создать нагрузку на всю базу данных поэтому лучше делать выборку

SELECT * FROM users WHERE status='work';  # выгрузить из таблицы users где статус равен work запрос с условием
+----+--------+---------+------+-------------------+--------+
| id | name   | surname | age  | email             | status |
+----+--------+---------+------+-------------------+--------+
|  1 | Ivan   | Petrov  |   25 | petrov@company.ru | work   |
|  3 | Fyodor | Karpin  |   27 | fyodor@company.ru | work   |
+----+--------+---------+------+-------------------+--------+

13 модифицируем нашу запись 
UPDATE users SET status='work' WHERE surname='Malevin';  # SET установить статус work, где фамилия Малевин, для малевина статус work вкратце

14 SELECT * FROM users;    # вижу что у всех статус work
SELECT * FROM users WHERE status='work';  # тоже увижу что он под этот запрос поподает 
+----+--------+---------+------+-------------------+--------+
| id | name   | surname | age  | email             | status |
+----+--------+---------+------+-------------------+--------+
|  1 | Ivan   | Petrov  |   25 | petrov@company.ru | work   |
|  2 | Sergey | Malevin |   29 | serg@company.ru   | work   |
|  3 | Fyodor | Karpin  |   27 | fyodor@company.ru | work   |
+----+--------+---------+------+-------------------+--------+

15 DELETE from users WHERE surname='Karpin';      # удаляю из таблицы users  пользователя с фамилией "Karpin"

mysql> select * from users where status='work';  # проверяю 
+----+--------+---------+------+-------------------+--------+
| id | name   | surname | age  | email             | status |
+----+--------+---------+------+-------------------+--------+
|  1 | Ivan   | Petrov  |   25 | petrov@company.ru | work   |
|  2 | Sergey | Malevin |   29 | serg@company.ru   | work   |
+----+--------+---------+------+-------------------+--------+

16 INSERT INTO users VALUES('3', 'Fyodor', 'Karpin', '27', 'fyodor@company.ru', 'work');
# вернул его обратно 

17 SELECT COUNT(*) FROM users;  # посчитал количество записей в таблице users
+----------+
| COUNT(*) |
+----------+
|        3 |
+----------+
=================================================

18 GRANT SELECT,INSERT,DELETE,UPDATE ON company.* TO 'admin'@'localhost' IDENTIFIED BY 'Nq+hONHa<0GQ1';  
# даю привиилегии на все таблицы базы данных company.* (если надо таблицу конкретную то после точки название таблицы), пользователю admin в локальной системе (localhost) и индифицированный  by пароль 

19 \q    # выхожу от рута 

20 mysql -u admin -p  # зашел под пользователем
\s # смотрю под кем зашел какой статус

21 SHOW GRANTS FOR 'admin'@'localhost';  # смотрю права конкретного пользователя 

mysql> SHOW GRANTS FOR 'admin'@'localhost';
+----------------------------------------------------------------------------+
| Grants for admin@localhost                                                 |
+----------------------------------------------------------------------------+
| GRANT USAGE ON *.* TO 'admin'@'localhost'                                  |
| GRANT SELECT, INSERT, UPDATE, DELETE ON `company`.* TO 'admin'@'localhost' |
+----------------------------------------------------------------------------+
2 rows in set (0.00 sec)
\q

21 ls -lah /var/lib/mysql # здесь можно посмотреть все базы данных на сервере company, и другие 
	ls -lah /var/lib/mysql/company/


22 mysql -p
HELP # подсказки по командам без ;
STATUS # аналог \s

23 SHOW PROCESSLIST; # смотрю какие сейчас процессы происходят 
+-----+------+-----------+------+---------+------+----------+------------------+
| Id  | User | Host      | db   | Command | Time | State    | Info             |
+-----+------+-----------+------+---------+------+----------+------------------+
| 155 | root | localhost | NULL | Query   |    0 | starting | SHOW PROCESSLIST |
+-----+------+-----------+------+---------+------+----------+------------------+


24 find / -name my*.cnf # ищу конфиг mysql
/etc/my.cnf
Оптимизация mysql это очень тонкое дело зависит от ситуации

#skip-networking # чтобы нельзя было подключиться к базе по сети 
####################################################################
25 Восстановление пароль от базы данных

1 systemctl stop mysqld
2 mysqld_safe --skip-grant-tables &    # старый способ скипануть грант tables
3 mysql # все в базе данных
4 UPDATE mysql.user SET Password=PASSWORD('newpass') WHERE user='root';  # newpass новый пароль 
# в базе меняем для пользователя root пароль 
5 FLUSH PRIVILEGES;  # обновил привелегии 
\q
6 systemctl restart mysqld # или start
7 mysql -p # и новый пароль вводишь

суть останавливаешь сервер скип грант делаешь, задаешь пароль, обновляешь привилегии, рестартуешь сервер, и заходишь под пользователем
##################################################
Резервное копирование:
26 mysqldump --opt -p company  > company.sql   # пароль 
mysqldump -u root -p company > company.sql

less company.sql # почитать базу посмотрим что внутри 

DROP TABLE IF EXISTS `users`;
/*!40101 SET @saved_cs_client     = @@character_set_client */;
/*!40101 SET character_set_client = utf8 */;
CREATE TABLE `users` (
  `id` int(5) NOT NULL AUTO_INCREMENT,
  `name` varchar(64) DEFAULT NULL,
  `surname` varchar(64) DEFAULT NULL,
# тут говорится если будет сделан импорт то будет удалена текущая таблица и заменена на новую 

LOCK TABLES `users` WRITE;
/*!40000 ALTER TABLE `users` DISABLE KEYS */;
INSERT INTO `users` VALUES (1,'Ivan','Petrov',25,'petrov@company.ru','work'),(2,'Sergey','Malevin',29,'serg@company.ru','work'),(3,'Fyodor','Karpin',27,'fyodor@company.ru','work');
# во время импорта сделать следующие insert 
 
###############################################3
27
Импорт базы данных на сервере 
1 mysql -p 
2 DROP DATABASE company;
show databases;   # вижу что уже нету 
3 \q

4 mysql -p
CREATE DATABASE company; ## помни если базу удалил ее надо создать а потом импортировать
SHOW DATABASES;  		 # увижу company базу данных 

5 mysql -u root -p company < company.sql  # делаю импорт базы данных 

6 mysql -p # смотрим что туда закачалось 
7 USE company; 			# перехожу на нужную базу данных
  SHOW TABLES;         #смотрю таблицы 
  SELECT * FROM users;  # смотрию данные таблицы users 

  +----+--------+---------+------+-------------------+--------+
| id | name   | surname | age  | email             | status |
+----+--------+---------+------+-------------------+--------+
|  1 | Ivan   | Petrov  |   25 | petrov@company.ru | work   |
|  2 | Sergey | Malevin |   29 | serg@company.ru   | work   |
|  3 | Fyodor | Karpin  |   27 | fyodor@company.ru | work   |
+----+--------+---------+------+-------------------+--------+
########################################################
28 если база данных испортилась 
myisamchk /var/lib/mysql/company/users.MYI # проверка базы данных на ошибки можно так посмотреть 

29 myisamchk -r /var/lib/mysql/company/users.MYI # рекомендуется использовать для восстановления таблицы
   myisamchk -o /var/lib/mysql/company/users.MYI  # если -r не помог то тогда -o




